<!ELEMENT branches (branch+)>
<!ELEMENT branch (address, contact, hours)>
<!ELEMENT address (#PCDATA)>
<!ELEMENT contact (#PCDATA)>
<!ELEMENT hours (weekday, weekend)>
<!ELEMENT weekday (#PCDATA)>
<!ELEMENT weekend (#PCDATA)>
